Type,Start,End,Transcript
IRR,1415.26,1432.96,"Interviewer: And so, in between was June and as pilot school, he was he was there just I guess i'd be lying if I knew what he was doing there like just escape having a vacation or something but but but yeah he was there, he was, I think he was only there for maybe."
IRR,1434.31,1440.37,"Interviewer: Six months, maybe it was a very short time very short time, but he enjoyed it he liked the area."
IRR,1441.6,1442.53,"Interviewer: interesting area."
IRR,1444.3,1463.08,"Veteran: yeah it's it's um it's pretty unique I mean they've got like the I mean it's where all of our officers come to go to ocs if they don't go through the naval academy and then they've got the TVS is the basic school is there and then they also have like the scout sniper school is there."
IRR,1463.44,1465.72,"Veteran: On the TVS side so there's."
IRR,1466.44,1475.47,"Veteran: In the FBI Academy, too, it's like in between like different sides of the bases so there's there's quite a bit that goes on there and it's a pretty cool duty station."
IRR,1475.8,1478.26,"Interviewer: Oh wow more than I knew and ya I didn't know that all that stuff was there."
IRR,1480.78,1485.1,"Interviewer: that's cool you're in here originally from Minnesota Michigan sorry."
IRR,1485.64,1487.29,"Veteran: yep yeah born and raised."
IRR,1487.56,1489.09,"Interviewer: yeah where's Warren."
IRR,1490.11,1494.34,"Veteran: Warren is very, very close to Detroit it's literally like."
IRR,1496.2,1506.04,"Veteran: If you've ever met anybody from Michigan before and they said oh I grew up in metro Detroit that's kind of like what they're talking about is basically any city that surrounds like Detroit they just say Oh, I was."
IRR,1506.79,1511.89,"Veteran: Like raised in metro Detroit Warren is like just outside of Detroit city limits."
IRR,1512.34,1517.17,"Interviewer: yeah i've been to Detroit a few times I was actually born and raised in indiana so."
IRR,1517.98,1518.46,"Veteran: Oh, really."
IRR,1518.7,1530.52,"Interviewer: yeah just in bloomington a little bit south of a actually, so I was actually born in Kentucky but raised in indiana bloomington it's a little bit south of ndianapolis and I spent some time in Detroit so very interesting area."
IRR,1544.23,1545.46,"Interviewer: Well they're 15 minutes is."
IRR,1546.69,1547.95,"Interviewer: turning into A little bit longer, I think."
IRR,1548.7,1553.14,"Veteran: yeah I think I think someone did come knock on the door, I think, maybe it was him, so I guess I better."
IRR,1553.56,1555.36,"Veteran: Okay they're they're probably like."
IRR,1556.86,1562.08,"Veteran: They were telling me that they're like yeah you're pretty stressed out filling out those forms, I was like really this is how I feel all the time."
IRR,1564.3,1572.7,"Interviewer: Well yeah I think they tried to meter me because they asked me how many cups of coffee, I had I had already had like two or three cups of coffee I start my morning with coffee coffee so."
IRR,1573.3,1580.68,"Veteran: yeah same here after i've done like the gym and everything I go straight to class and a couple coffees in my hands."
IRR,1581.91,1586.62,"Interviewer: There you go exactly and I gotta say I mean from a from a just from a."
IRR,1587.52,1593.52,"Interviewer: You know, face to face sorta thing you seemed pretty relaxed you ain't seem like you know I mean and that's the way you should be in any interview I mean."
IRR,1594.12,1604.02,"Interviewer: Have confidence in yourself, I mean you got great history, and you know, taking the school, you need, so I think just keeping that confidence is the way to go, you know not being overconfident but, obviously."
IRR,1604.53,1613.08,"Interviewer: just being confident in what you're talking about being honest, you know if you don't know something you don't know something I didn't you know ask anything too technical so nothing you wouldn't have known."
IRR,1614.91,1615.93,"Veteran: i'm just thankful for that."
IRR,1620.01,1622.29,"Interviewer: yeah I would have had a math question to like look up."
IRR,1623.37,1625.44,"Interviewer: don't ask me any higher math questions."
IRR,1625.92,1627.45,"Veteran: yeah same here."
IRR,1630,1630.45,"Interviewer: well."
IRR,1631.53,1632.4,"Interviewer: I wonder, I wonder if."
IRR,1634.59,1635.7,"Interviewer: They got that there."
IRR,1637.23,1639.03,"Interviewer: Maybe I just drop her an email and."
IRR,1645.42,1648.45,"Interviewer: I'd hate for them to mess up by you taking everything off if they need to."
IRR,1649.89,1650.79,"Interviewer: Stop something."
IRR,1652.35,1652.98,"Veteran: Oh yeah."
IRR,1658.8,1662.52,"Interviewer: I have her computer it's probably gonna come up on your computer that that I sent her an email but."
IRR,1672.27,1675.75,"Veteran: yeah fort brave is another interesting TVS station that was very."
IRR,1677.31,1678.27,"Veteran: very interesting."
IRR,1678.69,1679.08,"Interviewer: Was it."
IRR,1679.62,1686.7,"Veteran: yeah it I I actually learned a lot, while I was there too just how like like the 82nd in."
IRR,1689.1,1699.06,"Veteran: which we call it what said a camp McCall for the Green Berets go to and get trained and everything and yeah and then Pope."
IRR,1700.98,1711.78,"Interviewer: Pope airfield for sure I didn't know that much I don't know much about Mccall that obviously you know the 82nd airborne you gotta get to know them and and then Pope."
IRR,1713.76,1717.75,"Veteran: yeah I think I think he's ready for me now he's knocking on the doors."
IRR,1717.99,1719.61,"Veteran: Oh well, thank you again for your time."
