Type,Start,End,Transcript
A11,1464.46,1476.1,"Veteran: office three guys I could, and I gave her a scenario I said, these guys are your team you're the team leader and they just messed up and you've got to discipline them how are you going to do it."
A11,1476.43,1493.77,"Veteran: And they they don't respect you they they are sexist and bigoted and it's it's a situation she's likely going to run into unfortunately it's true but, so I ran her through that situation, she did a great job we all did a little physical fitness."
A11,1495,1499.47,"Veteran: Exercise plan that you chew and we were all exhausted and feel great job."
A11,1500.97,1510.36,"Veteran: So yes, again a longer answer to your question is is once we build up that trust, then I am all for."
A11,1510.78,1522.21,"Veteran: Taking the hands off approach of here's What I want, I want you to see, I want to see creativity, I want to see you challenge this in a way that I could not have and in a way that i'm going to learn something from."
Q12,1525.21,1539.91,"Interviewer: awesome no that's great great answer well sounds like you're going to graduate in 2023 and go do big big thing so like in five years, where were you hoping to be five years from now, which is a relatively finite amount of time."
A12,1540.93,1549.9,"Veteran: Five years from now, I am hoping to be settled down in a House in the Dallas area."
A12,1551.04,1559.11,"Veteran: With a my dog and maybe nice lady, and maybe even some kids and."
A12,1560.82,1562.86,"Veteran: As far as career wise."
A12,1564.57,1576.06,"Veteran: I could have my own company, I could be working where i'm working now with a lot of the entrepreneur centers for veterans it's pretty open so pretty open door so."
IRR,1579.12,1581.37,"Interviewer: awesome well any any questions for me."
IRR,1582.42,1589.11,"Veteran: uh no ma'am no questions for you, thank you for your time and helping me do all this."
IRR,1589.68,1589.98861,"Interviewer: yeah "
